"Lorem ipsum dolor sit amet, consectetur adipiscing elit. Aenean nunc tellus, feugiat et mollis ac, egestas eu enim. Pellentesque non metus at ante facilisis viverra id at massa. Aliquam aliquet ligula lacus. Suspendisse eu purus et dolor feugiat finibus. Mauris in enim vel enim egestas suscipit. Sed justo lacus, rutrum id rhoncus in, eleifend a orci. Aenean sodales augue eros, quis auctor odio tempor vel. Nam mollis eget lorem ut egestas. Pellentesque maximus consequat nibh ut blandit. Aenean sed urna turpis. Praesent id massa arcu. Vivamus cursus luctus convallis. Mauris sem augue, sodales nec scelerisque quis, vulputate eget dui. Duis interdum ante nec euismod auctor. Morbi non gravida erat, eget accumsan orci. Aenean elementum sagittis lacus ac pellentesque."
"Integer facilisis velit nunc, ac congue sem volutpat ac. Aenean vehicula consequat elit, vel laoreet leo volutpat iaculis. Donec lacinia convallis fermentum. Nulla facilisi. Vestibulum dictum augue ipsum, in consequat purus cursus eu. Etiam feugiat lorem id commodo eleifend. Proin laoreet nibh sapien, non fermentum odio eleifend eu. Maecenas mollis ullamcorper risus, eget ultricies neque vehicula convallis."
"Ut a ex nec nunc condimentum pellentesque sit amet id arcu. Praesent non varius ipsum, tincidunt viverra ex. Ut at dolor sit amet urna condimentum pulvinar. Nulla vitae diam tempor, condimentum mauris et, lacinia nunc. Sed sit amet ante ut magna posuere venenatis. Nulla rutrum malesuada quam, ultricies fringilla purus fringilla ac. Duis porttitor tellus vitae tellus imperdiet laoreet. Aliquam vel velit pellentesque, pharetra dui vel, euismod orci. Ut pellentesque luctus mollis."
"Aenean laoreet facilisis lacus a elementum. Cras vitae sapien tincidunt, feugiat arcu sit amet, auctor risus. Praesent pharetra arcu mi, ac malesuada dui venenatis condimentum. Donec molestie, nulla ac vestibulum tincidunt, est orci venenatis est, vel faucibus magna sapien eu eros. Sed hendrerit, mi nec mattis venenatis, metus augue cursus risus, et finibus elit justo non tellus. Duis dictum leo vitae orci mattis suscipit. Nunc ac ultrices sapien, vel tincidunt dui. Praesent dui lorem, sagittis sit amet sapien ac, fringilla finibus eros. Ut consequat, dui non facilisis iaculis, velit tellus pharetra mauris, in ultrices eros leo eu metus. Aenean eu lectus nulla."
"Suspendisse imperdiet massa sed porta ornare. Maecenas vel dictum orci. Pellentesque et velit sapien. Mauris non scelerisque nulla. In hac habitasse platea dictumst. Morbi ut porta massa. Donec quis neque quis ipsum fermentum tempus. Aenean non quam lacinia, imperdiet est nec, cursus nibh. Donec elementum mattis magna, nec varius dui efficitur at. Pellentesque congue sapien iaculis blandit luctus. Nullam feugiat nisi velit, vel tristique est aliquet ut. Sed vitae dolor ultrices, elementum enim vitae, scelerisque enim. Donec convallis lorem ipsum, nec dictum est luctus at."
"Proin convallis est pharetra tellus ultricies, at vestibulum ligula vulputate. Maecenas et scelerisque magna, imperdiet tristique massa. Pellentesque habitant morbi tristique senectus et netus et malesuada fames ac turpis egestas. Quisque id nisi congue, commodo dolor in, volutpat tortor. In rhoncus maximus est eget pharetra. Donec tempor aliquam ipsum, a facilisis erat facilisis sit amet. Donec vestibulum ante sit amet interdum sodales. Pellentesque id purus non purus condimentum viverra. Nullam bibendum sollicitudin facilisis. Aliquam vel fringilla ante."
"Etiam sed mi quis ligula consectetur pellentesque sit amet id leo. Donec ultrices ipsum non enim hendrerit vehicula. Phasellus et blandit dui, eget fringilla velit. Duis et odio at nulla egestas convallis. Fusce malesuada leo id nisl vulputate volutpat quis a quam. Nulla placerat pulvinar porttitor. In hac habitasse platea dictumst."
"Nullam mollis gravida risus, nec suscipit mauris viverra at. Morbi aliquam nunc nec lectus tempor gravida. Phasellus eleifend semper enim eget ultricies. Integer suscipit convallis est, vel commodo augue maximus non. Pellentesque nec lobortis orci, sed pellentesque massa. Integer tempor a leo et pretium. Maecenas a placerat purus. Integer malesuada convallis dolor vel condimentum. Duis ut nisl et lacus vehicula condimentum dapibus ut arcu. Vivamus in neque sit amet tortor pulvinar porta id vitae est. Ut dignissim ligula pharetra arcu consectetur, vel imperdiet libero porta."
"Pellentesque consequat blandit euismod. Vivamus viverra lectus libero, non tempus lacus aliquet ut. Vestibulum non dui nulla. Fusce malesuada sem in porttitor finibus. In viverra vitae orci a venenatis. Fusce condimentum dictum placerat. Nulla facilisi. Maecenas sed ipsum pharetra, bibendum sem in, fringilla diam. Vestibulum et quam condimentum, interdum tortor at, feugiat tellus. Nunc auctor leo et leo commodo, eu scelerisque massa tristique. Pellentesque habitant morbi tristique senectus et netus et malesuada fames ac turpis egestas. Proin interdum turpis ac dui tempus porttitor."
"Duis est risus, dictum ut massa et, ornare mollis arcu. Pellentesque habitant morbi tristique senectus et netus et malesuada fames ac turpis egestas. Nulla eget diam nec ex venenatis tempor vel semper ante. In sed pellentesque magna. Praesent facilisis ultrices ipsum, id sagittis neque. Praesent tincidunt tellus tortor, et condimentum ante aliquet quis. Duis tristique urna at nulla commodo, sed laoreet sapien ultricies. Nam semper quis enim mollis semper. Mauris convallis est tincidunt, semper magna eget, mollis dui. Morbi vitae venenatis mi. Etiam fermentum facilisis volutpat."
"Nunc id purus dui. Integer fermentum libero magna, nec commodo velit facilisis luctus. Cras faucibus orci in cursus elementum. Proin tincidunt egestas malesuada. Sed tristique massa eros, sit amet vulputate magna finibus semper. Nulla rutrum sodales mollis. Maecenas molestie ut orci sit amet mollis. Pellentesque sed urna sed nibh maximus pellentesque. Praesent sed neque nisl. Nulla in libero metus. Praesent ac nunc et nisl pretium elementum. Sed euismod ligula felis, vel finibus risus imperdiet non."
"Ut ut sem ac ipsum dignissim scelerisque. Fusce convallis nec nunc sit amet finibus. Cras vulputate enim quis vulputate tincidunt. Praesent eget lorem nunc. Fusce vel posuere neque. Etiam interdum id sem ut sagittis. Sed egestas scelerisque tristique. Nunc aliquam urna et hendrerit eleifend. Pellentesque sem massa, scelerisque fringilla suscipit vel, feugiat nec enim. In hac habitasse platea dictumst. Ut viverra aliquam tortor non dignissim. Cras dignissim risus eu diam mollis placerat. Nullam volutpat elit eget lorem semper, in lacinia lectus convallis. Curabitur sagittis nulla quis mollis ultricies. Nullam fringilla ligula orci, malesuada fermentum mauris scelerisque id."
"Pellentesque eu justo nec risus euismod pellentesque. Phasellus sed aliquam tortor. Pellentesque eros libero, vulputate at consequat in, placerat vitae augue. Aenean et rutrum felis. Morbi ac nunc ac urna tincidunt accumsan. Curabitur eget mattis purus, convallis commodo est. Nulla pulvinar nibh vel elit blandit iaculis et et lorem. Cras hendrerit molestie nisi id venenatis. Nulla quis fermentum erat. Pellentesque semper consequat viverra. Vestibulum ultricies mi at rutrum finibus. Phasellus finibus lacinia maximus. Nam vitae tellus ut erat laoreet fermentum ut ac neque."
"Nulla fermentum est in purus sollicitudin viverra. Maecenas quis massa varius, tempor purus vel, suscipit erat. Proin diam magna, lobortis id elit a, auctor rhoncus diam. Nam ullamcorper enim eget purus commodo, quis posuere tortor viverra. Aenean porta, odio vitae vestibulum gravida, nisi lacus ultricies tortor, sed efficitur diam nulla in felis. Aliquam erat volutpat. Quisque vulputate nunc id turpis eleifend, egestas convallis sapien luctus. Suspendisse potenti. Vivamus in sem malesuada lacus fermentum scelerisque elementum non velit. Morbi rhoncus tempus fermentum. Aenean posuere maximus pharetra. Aenean auctor in ligula vel pretium. Mauris facilisis condimentum velit sit amet suscipit. Nulla ultrices odio ac turpis porta maximus. Vestibulum gravida a leo consequat dignissim."
"Phasellus scelerisque lectus eu urna lobortis, vel vehicula justo sagittis. Sed bibendum nec ante non pellentesque. Nulla sed arcu quis purus euismod condimentum nec ut dolor. Vivamus sed condimentum tortor. Quisque semper et odio at rutrum. Sed vel eros imperdiet, varius nunc vel, tempor massa. Curabitur ut scelerisque augue, vitae pellentesque eros. Aliquam quis tellus ac nisi auctor aliquam sed et lacus. Praesent posuere in nunc ut consectetur. Vestibulum rutrum ultricies sem, sed laoreet tortor porta at. Cras vestibulum ex eget leo finibus blandit. Nunc semper fringilla nunc non tincidunt. Duis tincidunt felis rhoncus neque eleifend, vel scelerisque enim bibendum. Etiam sodales justo et tortor pellentesque, quis rhoncus nisi iaculis. Aliquam erat volutpat. Integer imperdiet sapien nec nunc fermentum, vitae condimentum ligula hendrerit."
"Phasellus viverra, nisl eu mattis blandit, lacus felis pulvinar velit, ac facilisis lacus ligula at metus. Praesent tempus egestas eleifend. Cras mattis ornare ex semper varius. Suspendisse gravida efficitur massa, vel convallis purus dignissim aliquet. Duis volutpat, metus id luctus feugiat, ligula arcu porttitor quam, in imperdiet nulla sapien in lorem. Sed consectetur pulvinar quam, in gravida erat mollis eget. Curabitur varius lorem vitae arcu convallis bibendum. Vestibulum ullamcorper nisi eu malesuada bibendum. Nullam eu mauris purus. Suspendisse potenti. Suspendisse tortor ante, hendrerit a lorem vitae, facilisis porttitor lacus. Nunc at velit faucibus, ultrices lorem sed, placerat augue."
"Praesent a dolor in odio iaculis vestibulum. Phasellus tempor sapien sed nisl viverra tincidunt. Ut at congue leo, nec vulputate quam. Proin aliquet, diam eget finibus interdum, lorem urna mollis sapien, et viverra leo nulla feugiat risus. Suspendisse vitae rutrum lacus, ac egestas neque. Nunc quis consequat nisl, vel commodo dui. Duis pellentesque arcu magna, vel efficitur libero vehicula maximus. Ut bibendum elementum nulla, non dictum magna auctor at. Pellentesque sit amet tincidunt nisi. Donec quis fringilla est, id dignissim arcu."
"Curabitur eget risus quis massa viverra sollicitudin. Vivamus in lorem varius, consectetur libero in, bibendum ante. Sed et mi augue. Curabitur cursus, magna ut mollis vehicula, nisi lacus tristique felis, vel auctor enim sapien eu nunc. Nulla porttitor viverra lobortis. Orci varius natoque penatibus et magnis dis parturient montes, nascetur ridiculus mus. Nullam et ornare ex, facilisis feugiat metus. Donec cursus hendrerit sapien, quis lobortis leo facilisis quis. Nunc rhoncus cursus blandit. Donec ut ex et ante porttitor dictum et ac lacus. Vestibulum sodales, odio eget ornare volutpat, quam mauris consectetur diam, id sodales libero quam ut est. Sed eget urna ligula. Nulla aliquet eros ac ipsum pretium sollicitudin."
"Ut nec velit quis odio gravida rhoncus sed vitae lectus. Vestibulum ante ipsum primis in faucibus orci luctus et ultrices posuere cubilia Curae; Mauris rutrum fermentum auctor. Ut a diam vel orci vehicula condimentum. Sed a magna imperdiet, malesuada neque vitae, consectetur nibh. Morbi eleifend consequat lectus id malesuada. Aenean ac malesuada nisl. Nunc auctor mollis facilisis."
"Ut quis accumsan ligula. Nam nec consectetur velit. Nulla facilisi. Donec consectetur dapibus augue, quis finibus felis fermentum malesuada. In ullamcorper dignissim aliquam. Sed egestas, tellus eget suscipit semper, tellus nisi tincidunt libero, sit amet pharetra libero mauris vel est. Nunc maximus nunc luctus nibh mattis egestas. Nam porta sodales imperdiet. Suspendisse dictum ipsum vitae ex placerat tristique. Sed pulvinar, metus non placerat blandit, sapien tortor vulputate orci, vel facilisis est purus sit amet sapien."
"Vivamus augue risus, convallis ac iaculis et, interdum quis enim. Nam ullamcorper est et diam gravida dictum. Cras id euismod odio, a euismod ipsum. Pellentesque pharetra odio in lectus eleifend, ac imperdiet mi accumsan. Aliquam a justo auctor, eleifend felis id, volutpat orci. Vivamus scelerisque sapien eget orci interdum, id dictum lectus commodo. Curabitur non lorem lorem. Morbi a fermentum massa, id venenatis arcu. Nam non neque nec lacus vehicula aliquet. Cras efficitur risus eget enim aliquam convallis et nec ante. Quisque sollicitudin aliquet cursus."
"Donec sit amet tempus diam, et laoreet lacus. Integer pharetra, purus id volutpat viverra, nunc ante fermentum urna, pretium ornare nisi sapien tempor libero. Proin tortor quam, sagittis nec ligula sed, sagittis consequat enim. Fusce placerat, odio vitae laoreet semper, tortor diam suscipit ipsum, pharetra posuere velit enim eu orci. Curabitur molestie nunc blandit mauris tempus, sed sollicitudin urna molestie. Proin finibus imperdiet dui, eget scelerisque purus. Donec imperdiet, purus et commodo accumsan, arcu sem malesuada dolor, dapibus accumsan orci ante sit amet ipsum. Mauris laoreet mauris nec est vehicula, eget fringilla massa scelerisque. Morbi porta luctus dapibus."
"Aenean rutrum nec libero sit amet ullamcorper. Donec tempor lacus ipsum, ut consectetur felis ultrices mollis. Etiam nec enim blandit, consequat libero a, porttitor est. Fusce aliquam, tortor non iaculis ultrices, ante massa porttitor ex, in lobortis tellus mi ac eros. Fusce elementum lacus leo, sed efficitur tellus consequat eu. Ut viverra tristique dui, a iaculis velit dignissim eu. Nullam porttitor, sem sit amet consequat malesuada, mauris mi molestie quam, non cursus quam felis sit amet lorem. Fusce ac mattis est. Donec rutrum consectetur ex et convallis. Praesent ac consequat augue. Fusce varius dolor arcu, at aliquam enim semper a. Sed bibendum venenatis leo vitae consectetur. Praesent consectetur ipsum ullamcorper massa volutpat, at finibus turpis cursus."
"Vivamus ullamcorper faucibus urna ut iaculis. Class aptent taciti sociosqu ad litora torquent per conubia nostra, per inceptos himenaeos. Maecenas ullamcorper velit nec orci malesuada porta. Morbi facilisis tempus velit, sed vestibulum arcu hendrerit quis. Aenean at purus quis nisi laoreet vestibulum in in dui. Mauris auctor quis nulla non luctus. In ullamcorper diam felis, a laoreet mauris fermentum et. Nullam varius lacus id eros euismod, in hendrerit eros euismod. Vivamus gravida arcu vitae arcu lobortis, posuere tempor dui consectetur. Proin eu dolor et dolor malesuada malesuada. Pellentesque eros erat, rhoncus eu mattis ac, cursus eget risus. Proin vestibulum metus leo, eget consequat purus facilisis ut. Nullam orci nibh, dapibus a neque quis, cursus rhoncus mauris. Morbi tellus nulla, fermentum sed pretium vel, euismod nec arcu. Sed at sodales nisl."
"Aliquam viverra lorem sit amet odio interdum accumsan. In faucibus nunc dapibus ipsum mattis ornare. Ut ut augue iaculis, aliquam sem eget, dapibus ligula. Vivamus condimentum fringilla dolor eget sollicitudin. Praesent nec condimentum magna. Morbi tincidunt nibh quis justo tempor, vitae dictum orci ultricies. Donec imperdiet justo nec dolor malesuada dignissim sed quis augue. Nullam consequat, orci vitae accumsan tristique, magna nisi euismod turpis, nec mollis elit ipsum bibendum libero. Suspendisse lacinia eleifend dui, quis pellentesque mauris blandit quis. Cras non orci vel neque iaculis feugiat. Morbi urna arcu, efficitur vel felis vel, commodo fringilla turpis. Proin dapibus quis massa ut gravida. Etiam varius urna ipsum, ut porta erat porta et."
"Phasellus sit amet velit at nulla tristique sodales sit amet in libero. Cras condimentum maximus fringilla. Suspendisse posuere diam vel mi ultricies commodo. Vestibulum ante ipsum primis in faucibus orci luctus et ultrices posuere cubilia Curae; Phasellus ut lorem nulla. Aliquam arcu est, auctor sed vestibulum quis, mollis nec urna. Mauris dignissim augue ipsum, ut ultrices nisi rutrum at. Nunc elementum lacus vitae quam rutrum molestie. Duis consequat justo id urna cursus, porta dapibus risus tristique. Ut pretium nisi sit amet urna lacinia, quis placerat ipsum volutpat. Nam quis nunc mi. Integer vulputate, nisl nec fermentum semper, justo dui tempus leo, sit amet porttitor lectus eros vitae lectus. Ut diam lacus, dictum nec lacus nec, venenatis porttitor sapien. Donec ut ante metus."
"Aenean euismod fermentum odio, vitae dictum lectus ornare sed. Nulla facilisi. Nullam pharetra semper libero eget congue. Aliquam ut lectus nec sapien viverra imperdiet. Vivamus tellus nibh, mollis non mauris vitae, tempus interdum tellus. Etiam nec justo ac nisi dapibus venenatis. Mauris ac vulputate purus, non tempor lectus. Sed et mattis risus. Curabitur finibus tortor nec ligula lacinia, nec vehicula nibh accumsan. Pellentesque ac interdum tellus."
"Donec rutrum, lacus non euismod ornare, nunc quam mattis elit, nec scelerisque erat felis id sem. Sed vehicula nulla ipsum, bibendum porttitor sapien efficitur semper. Etiam iaculis justo eu dui commodo, quis dictum eros feugiat. Pellentesque elementum lorem eros, id malesuada elit ullamcorper at. Mauris quis elit faucibus, dictum tortor quis, dictum nisi. Sed dignissim arcu sit amet est gravida bibendum. Mauris quis ex in ipsum eleifend placerat a a dolor."
"Proin sit amet arcu sagittis, molestie nunc ac, iaculis mi. Nulla facilisi. Maecenas vehicula, leo eu rhoncus tempus, enim urna bibendum diam, in pharetra libero felis vel felis. Duis mollis lorem risus, eget consequat leo semper a. Integer hendrerit ante eu nisi vulputate blandit a in velit. Etiam quis lectus nec ligula ultricies aliquam. Nulla facilisi. Morbi magna tortor, dignissim vel libero at, bibendum pulvinar enim. Donec id dolor id ipsum egestas mattis. Fusce ultricies dolor vulputate sem semper sagittis et vitae ligula. Morbi orci lacus, condimentum nec odio in, mollis bibendum ligula."
"Nullam bibendum cursus massa sit amet venenatis. In sed ipsum gravida, tempus ligula a, faucibus neque. Donec porttitor semper aliquam. Nulla fringilla finibus metus vitae euismod. Nulla eu erat sem. Morbi non est arcu. Proin non lectus porttitor libero viverra condimentum elementum id est. Vivamus pellentesque nulla ut augue elementum semper consectetur ac tellus."
"Mauris rhoncus odio elit, nec posuere risus sagittis in. Mauris sed varius turpis, sit amet dignissim nibh. Ut ac rutrum nisl, eu ornare tortor. Vivamus malesuada nulla condimentum elit aliquet, quis posuere nunc vehicula. Vivamus blandit iaculis rhoncus. Proin sit amet velit vulputate, interdum neque non, commodo nisi. Quisque in nibh tempor, venenatis massa quis, bibendum lacus. Donec nec nibh aliquam, rutrum justo fermentum, viverra magna. Sed sed augue mattis, faucibus mauris in, dapibus erat. Praesent arcu nibh, lobortis a odio et, sodales mattis lectus. Fusce nec suscipit nisi. Mauris ac purus scelerisque, varius erat a, tristique sapien. Etiam luctus tempus est, vestibulum porta justo commodo mattis."
"Pellentesque pulvinar tincidunt congue. Sed pretium justo non ipsum commodo, in laoreet tortor sagittis. Cras sem turpis, consectetur eu dolor vitae, ultrices ornare dolor. Integer quis nisl non elit elementum ultrices. Etiam condimentum tempus erat, non congue tortor rhoncus in. Morbi in est ut justo porta convallis eu eu lacus. Sed volutpat vel elit vitae dictum. Vivamus vel justo velit."
"Nam nec erat sapien. Cras eget commodo sapien. Quisque congue ligula vel arcu bibendum porttitor sed a arcu. Morbi sodales tincidunt metus, vitae fermentum tortor sagittis at. Ut sit amet dui nec eros feugiat vulputate et et sem. Curabitur fermentum est fermentum, accumsan magna ut, venenatis ligula. Nulla a enim pretium arcu posuere ultricies a eu est. Nulla neque quam, consequat id nisi nec, dignissim accumsan lectus. Suspendisse laoreet, lacus gravida eleifend porta, nisi dui venenatis sem, vel sollicitudin nunc ex in sapien. Nam ac elit placerat, mattis odio eu, vehicula ante. Vivamus vitae scelerisque sem, non facilisis mauris. Mauris lobortis metus sit amet eros pellentesque porttitor. Aliquam erat volutpat."
"Duis vel tristique justo. Sed posuere efficitur urna, tristique congue nulla porttitor eu. Nullam venenatis arcu vel mauris ultricies tempor. Nam ac sem congue, mollis dui et, pharetra nulla. Maecenas scelerisque ante sit amet nulla fermentum pretium. Nam semper a sapien et vehicula. Praesent vel massa feugiat orci faucibus posuere non rhoncus felis. Proin aliquam ante non neque hendrerit, id maximus metus euismod. In commodo, tellus vel sollicitudin ultricies, mi velit tincidunt sem, nec mollis nunc lectus ac lectus. Maecenas a sagittis neque, quis luctus diam. Morbi ac varius ligula. Etiam a velit sed elit bibendum sagittis sit amet finibus quam. Interdum et malesuada fames ac ante ipsum primis in faucibus. Fusce ac nulla tellus."
"Ut eu mauris ante. Curabitur vitae augue viverra massa condimentum porta et in libero. In euismod dolor in elit lacinia aliquam. Integer eu metus ut sapien suscipit molestie. Proin elementum turpis libero, nec lobortis diam malesuada eu. Nam elit sapien, blandit nec justo vitae, finibus pellentesque dui. In congue, lacus at sollicitudin mattis, metus dolor pulvinar dui, et faucibus magna augue tristique augue. Aenean posuere eros ac est elementum volutpat. Donec facilisis gravida arcu sit amet aliquet. Nulla facilisi. Donec mollis gravida porttitor. Donec dapibus faucibus mi, nec tempor elit sodales sed. Aenean pulvinar mauris ex, ac viverra massa lacinia et."
"Vestibulum dictum nibh purus, a luctus ante malesuada quis. Nullam tempor nunc ac lorem pulvinar dapibus. In neque elit, iaculis et imperdiet a, hendrerit sed nulla. Aenean a eros in risus ultricies accumsan non id dolor. Nullam pulvinar vulputate nibh, eget iaculis arcu vestibulum et. Aenean turpis arcu, vulputate vel elementum eu, sollicitudin at enim. Nam ultrices iaculis nulla, at rutrum metus sagittis eu."
"Donec vehicula, tellus non dictum auctor, nisi libero rutrum lorem, et pretium metus magna placerat ex. Morbi ullamcorper nunc mauris, id commodo neque aliquam at. Vivamus vel tellus vel ligula scelerisque bibendum at ut massa. Interdum et malesuada fames ac ante ipsum primis in faucibus. Donec at finibus magna. Orci varius natoque penatibus et magnis dis parturient montes, nascetur ridiculus mus. Morbi porttitor cursus dui vel facilisis. Nulla suscipit libero magna, vel viverra massa molestie at. Sed hendrerit urna leo, eget pharetra turpis molestie laoreet. Nullam eu sodales massa, eu bibendum tortor. Mauris tincidunt lacus tortor, id laoreet libero iaculis vel. Etiam euismod egestas facilisis."
"Vivamus nunc turpis, tincidunt nec auctor sed, sagittis eu dui. In hac habitasse platea dictumst. Mauris pharetra metus id velit elementum, id tincidunt nisl gravida. Phasellus ac finibus elit, consectetur feugiat leo. Vestibulum turpis lacus, vehicula tristique aliquet in, rutrum sed felis. Vestibulum maximus metus at augue blandit rutrum. Phasellus sit amet erat sit amet risus elementum interdum. Nullam vulputate pharetra scelerisque. Aliquam erat volutpat."
"Nulla egestas ut nisi dictum tempor. Quisque non rhoncus elit, vitae consequat elit. Donec mauris nisl, finibus vel posuere sit amet, dapibus efficitur enim. Morbi sed porttitor nisl. Suspendisse venenatis leo in felis maximus, id consequat tortor mollis. Fusce nibh purus, tristique a malesuada sed, placerat eu enim. Suspendisse suscipit magna et porttitor imperdiet. Cras non posuere orci, vel fermentum urna. Praesent id enim eleifend, varius mauris in, porta leo. Mauris ornare, nisl quis tempus fringilla, neque est commodo sapien, a facilisis felis lacus a justo. Curabitur lobortis nulla et sapien blandit elementum. Mauris vestibulum ultrices mi, at pulvinar enim. Donec consequat nibh urna, a facilisis sapien porta sit amet. Donec a lorem nibh. Suspendisse non justo in nibh interdum vulputate."
"Praesent massa nisl, tempus in gravida sit amet, egestas gravida purus. Donec faucibus nunc at neque posuere, ut porta lectus dignissim. Donec placerat efficitur blandit. Proin nec mi sed diam vulputate semper at nec dui. Aliquam lacinia rutrum accumsan. Curabitur non ultricies est. Etiam finibus laoreet dolor at laoreet. Etiam a tempus augue. Aenean eu dui non urna feugiat vehicula. Phasellus sodales sed eros in hendrerit. Sed ac pellentesque lacus. Ut elit ex, ornare at nisi nec, congue congue velit. Nullam condimentum egestas ligula vitae porta. Morbi vestibulum ante eget magna consectetur, eu ornare sapien porta."
"In cursus mi vel tempus scelerisque. Etiam ante risus, semper sed nulla sit amet, fringilla mollis nulla. Sed luctus, enim sed tempus imperdiet, metus diam pharetra risus, nec mollis quam justo sed nibh. Aliquam laoreet accumsan mauris, ac suscipit dui interdum eu. Maecenas imperdiet fermentum lectus, eu venenatis quam sollicitudin vitae. Maecenas quam justo, egestas in leo ac, volutpat egestas neque. Morbi luctus consectetur luctus. Quisque venenatis justo in arcu dictum, ac mollis enim tempor. Suspendisse at erat auctor, mollis nibh nec, eleifend mauris. Praesent vulputate volutpat ante. Quisque porttitor, orci a malesuada gravida, orci augue eleifend augue, sit amet efficitur augue nibh et turpis."
"Duis sem urna, tempor sed mauris vel, viverra mattis velit. Phasellus ut ultricies quam. Phasellus placerat pharetra tincidunt. Pellentesque posuere, neque nec congue congue, eros orci sodales sem, in tincidunt enim tortor ut velit. Nullam in ultricies est. Suspendisse tincidunt nunc ac lorem congue vulputate in eget mauris. Etiam rutrum tellus turpis, eget pellentesque lacus finibus id. Morbi consequat lectus quis euismod facilisis."
