"Integer eget velit volutpat, tincidunt quam id, commodo nunc. Quisque sagittis nibh condimentum, venenatis sem sit amet, tristique magna. Donec convallis dapibus ornare. Sed luctus non arcu nec consectetur. Integer feugiat facilisis elit at pellentesque. Praesent nunc velit, fringilla ut placerat eget, mollis ut enim. Aliquam odio mauris, vestibulum non ipsum non, posuere aliquet orci."
"Donec faucibus lacus sed dui dictum consequat. Maecenas porta velit nec massa pulvinar, quis feugiat lorem pretium. Donec justo ipsum, volutpat ut mi sit amet, imperdiet rutrum ante. Curabitur hendrerit mi placerat enim placerat, ut pharetra dui feugiat. Aliquam sit amet commodo urna. Pellentesque ullamcorper porta felis ac rutrum. Nam consectetur velit sed nunc iaculis, at efficitur velit consequat. Aliquam erat volutpat. Fusce sit amet eros sed nunc tincidunt accumsan nec a orci. Fusce sit amet euismod dolor, non maximus augue. Suspendisse sagittis vulputate augue id malesuada. In malesuada at ipsum at malesuada. Morbi pellentesque quis magna eleifend consectetur. Maecenas tincidunt efficitur mauris ut aliquet. Integer in semper metus. Phasellus convallis, orci id pharetra scelerisque, nunc orci hendrerit enim, nec bibendum dolor turpis faucibus odio."
"Vivamus in massa et arcu pulvinar mattis at ac quam. Mauris ac eleifend lectus, et volutpat ante. Phasellus purus est, ullamcorper non dapibus at, cursus non libero. Phasellus eget magna quam. Nunc blandit tellus nec turpis pharetra, et malesuada orci eleifend. Maecenas mattis libero dictum ullamcorper condimentum. Sed sollicitudin sagittis diam vel pellentesque. Aliquam nec dolor sed nulla eleifend dapibus eu vitae nunc. Nam ut lectus vel enim fringilla hendrerit in ut dui. Cras ornare hendrerit sapien, at auctor ex mattis id. Proin purus mi, accumsan eu lectus euismod, condimentum mollis magna. Morbi et venenatis lorem, in hendrerit sapien. Sed eu ante cursus, elementum nibh id, iaculis massa. Pellentesque in elementum velit."
"Sed scelerisque vestibulum porta. Duis a egestas magna, sed tincidunt mi. Morbi a lorem tortor. Donec sodales eros vitae nisi varius ultricies. Donec nunc arcu, tristique ac velit eget, mattis vestibulum ante. Curabitur mattis, arcu ac lobortis vulputate, enim erat posuere enim, vitae suscipit sem orci ut ligula. Morbi malesuada gravida lectus, ac fringilla nisi congue nec. Curabitur tempor erat ac lacus efficitur, non scelerisque diam ornare. In iaculis viverra commodo. In mollis sagittis massa at congue. Etiam laoreet nisi quis eros aliquam rhoncus. Duis ac condimentum lectus."
"Suspendisse pharetra, orci in porttitor euismod, dui urna fringilla libero, at malesuada libero nunc et est. Aenean a fringilla tortor, sit amet sollicitudin lectus. In at blandit dui, sodales dictum massa. Sed eu condimentum massa, tempus porta massa. In interdum nisl sed congue malesuada. Nunc varius volutpat tellus, et viverra risus dapibus tincidunt. Proin volutpat tempor consequat. Integer molestie mollis velit, iaculis venenatis massa euismod tincidunt. Pellentesque posuere dui eleifend rhoncus lobortis. Interdum et malesuada fames ac ante ipsum primis in faucibus. Cras semper ac augue sit amet sodales. Lorem ipsum dolor sit amet, consectetur adipiscing elit."
"Aliquam et ultricies sapien, quis sodales ex. Praesent eget justo massa. Morbi tincidunt lacus quis sollicitudin posuere. Quisque et magna ut libero ultrices ultricies. Pellentesque condimentum, nisl sit amet dignissim tempor, enim ligula consequat eros, eu sodales metus massa at nisi. Mauris tempus, justo ut ullamcorper tristique, erat nulla mollis dolor, vitae pulvinar nisl massa sit amet arcu. Ut neque dolor, commodo non mi id, lobortis iaculis elit. Vivamus at leo accumsan orci pellentesque pretium sit amet at erat. In hac habitasse platea dictumst. Vivamus vel augue vitae tortor posuere bibendum. In venenatis hendrerit semper. Morbi feugiat suscipit ligula, in vulputate magna ultrices quis. Nulla sed quam diam. Nam nulla nisi, pharetra tincidunt varius quis, lobortis vitae nisi. Cras luctus sit amet justo eget vestibulum."
"Integer tincidunt ante quis hendrerit semper. Sed at nulla vulputate, commodo velit a, vulputate orci. Donec vel purus sit amet nisi fringilla dictum. Aliquam nec mollis nisl. Mauris euismod dolor erat, ac auctor metus tristique sit amet. Donec quis leo mauris. Etiam placerat commodo quam sit amet fermentum. Pellentesque feugiat odio id lectus pharetra, eu consequat orci pulvinar. Suspendisse non libero ligula. Nam id libero nec turpis aliquam rhoncus eget ut ex. Maecenas ut vestibulum sapien. Quisque auctor vel metus et lacinia. Aliquam sapien dui, posuere nec enim vitae, dignissim semper urna."
"Maecenas egestas, dui ac iaculis vehicula, orci nisi molestie metus, id interdum felis neque quis ipsum. Vivamus lorem ex, dictum a sem sed, porttitor fermentum risus. Etiam volutpat id arcu a consequat. Donec a suscipit enim. Aliquam erat volutpat. Sed ac iaculis nisi, ac lacinia ipsum. Proin dapibus congue est vitae consectetur. Phasellus tempor, est ut suscipit ultricies, mi arcu auctor eros, eget congue lorem odio non lorem. Etiam ut ligula sed purus molestie auctor. Sed quis diam non urna lobortis malesuada. Sed vel faucibus nulla, a pharetra purus. Suspendisse egestas ipsum et odio ultrices, quis dictum urna mattis. Vestibulum diam odio, porttitor id nisl a, convallis ultrices lacus. Proin congue lorem erat. Fusce risus risus, placerat sed fringilla auctor, finibus sit amet elit. Donec tincidunt vehicula tellus ullamcorper ullamcorper."
"Class aptent taciti sociosqu ad litora torquent per conubia nostra, per inceptos himenaeos. Mauris ligula massa, semper eu sapien eu, viverra placerat ipsum. Ut tincidunt leo eu aliquet imperdiet. Nulla tincidunt diam eget tellus convallis condimentum. Ut dapibus urna a nunc cursus condimentum non ut ante. Maecenas quis eros facilisis, vestibulum massa at, aliquet ligula. Maecenas pulvinar venenatis quam, eget tincidunt ipsum elementum quis. Phasellus iaculis elementum diam, sit amet lacinia diam semper sit amet. Ut a risus sit amet est efficitur porttitor. Phasellus condimentum nisi sed sollicitudin aliquam. Cras malesuada ligula justo, eget iaculis odio lobortis quis. Quisque efficitur nulla augue, eget tempus purus eleifend non. Suspendisse quis porta odio, eu imperdiet arcu. Nulla elementum vel erat eget elementum."
"Maecenas convallis felis hendrerit ipsum feugiat scelerisque. Morbi laoreet orci leo. Interdum et malesuada fames ac ante ipsum primis in faucibus. Sed semper ligula in nunc semper, ut tempor ipsum volutpat. Vivamus at nibh condimentum, pulvinar turpis fringilla, auctor lacus. Suspendisse rutrum felis eu purus auctor, eu finibus risus condimentum. Suspendisse potenti. Suspendisse vehicula sapien id nunc varius, eu vulputate dolor rhoncus. Vivamus vulputate, diam ac gravida ultrices, diam dui rhoncus eros, at varius tellus justo at mauris. Fusce mattis accumsan mauris, eget luctus risus mollis id. Curabitur fermentum facilisis feugiat. Etiam eget dictum sem. Mauris consequat eu metus ac rhoncus. Sed facilisis elementum tristique. Maecenas vulputate nisi eget justo tincidunt sollicitudin. Etiam a orci tellus."
"Ut molestie magna lectus, quis pretium nisl dictum quis. Suspendisse quis elit et nulla venenatis posuere. Nam vitae purus et ligula iaculis porta nec eu ante. Phasellus id leo eget nunc sollicitudin laoreet. Pellentesque nec tristique mi, in laoreet enim. Aenean eu finibus dui, ac suscipit ipsum. Phasellus iaculis sem libero, eu lacinia erat hendrerit a. Sed ac augue tellus. Pellentesque in ornare turpis."
"Nulla vel lacus et dolor ultrices semper vitae sed sapien. Proin facilisis pulvinar mattis. Quisque maximus erat eget gravida sagittis. Vivamus placerat eget nisi at sollicitudin. Cras imperdiet sit amet arcu et congue. Praesent eget varius leo. Sed tincidunt, metus sit amet posuere vehicula, lorem turpis dictum nulla, eget laoreet nibh quam eget justo. Proin ut odio eget purus ultrices sagittis. Sed pharetra elit leo, a tempor odio viverra eu. Curabitur ut quam quis lorem venenatis auctor finibus in mi. Suspendisse potenti."
"Nunc nec nulla vel urna volutpat feugiat. Praesent maximus quam vitae dolor ornare, sed dapibus nunc tincidunt. Morbi non diam vitae turpis fermentum commodo in venenatis velit. Sed iaculis eros at interdum semper. Suspendisse at consectetur nunc. Cras ultrices non quam non pharetra. Duis pretium, augue id dignissim blandit, libero ex maximus metus, eu molestie ipsum tortor ut tellus. Suspendisse dui purus, placerat at quam in, eleifend convallis magna. Sed sed magna vehicula, pulvinar nunc vel, elementum quam. Nullam ligula velit, imperdiet a tellus in, aliquam luctus orci."
"Pellentesque at posuere justo. Duis velit magna, tincidunt id congue sed, ultricies fermentum metus. Donec vestibulum ultrices bibendum. Morbi tempus hendrerit risus, non porta augue suscipit in. Vivamus sed diam accumsan, suscipit magna sed, porttitor ex. Donec dignissim sodales nulla eget viverra. Quisque at purus in felis malesuada tempus non ut urna. Duis non luctus ex."
"Vivamus bibendum ex hendrerit lacus ullamcorper vulputate. Aenean justo felis, mollis non nisl sed, consequat bibendum tortor. Vivamus commodo ultrices erat, a semper lectus pulvinar et. Lorem ipsum dolor sit amet, consectetur adipiscing elit. Praesent euismod a arcu volutpat consequat. Mauris risus dolor, dapibus quis interdum eget, tincidunt nec eros. Nulla id mauris ut est semper varius. Etiam aliquet dictum nisi ac porta. Ut vestibulum at quam in porttitor. Vivamus sit amet odio mi. Mauris eu pellentesque neque."
"Maecenas convallis egestas nisi nec ultrices. Maecenas risus diam, bibendum eu tristique vel, fringilla sed libero. Vivamus pharetra risus sit amet mi vehicula, vel tincidunt neque porttitor. Fusce placerat molestie odio et finibus. Curabitur urna arcu, finibus in convallis et, tempor quis risus. Vestibulum euismod aliquam ligula id posuere. Nullam id efficitur orci. Suspendisse lectus dolor, lacinia ut varius a, gravida id elit. Nullam dolor risus, placerat id est vitae, ornare interdum arcu."