"Nulla a justo ex. Nulla in sapien urna. Vestibulum ante ipsum primis in faucibus orci luctus et ultrices posuere cubilia Curae; Maecenas euismod elit ac lorem vulputate condimentum. Aenean id mauris ac tellus blandit fermentum. Morbi placerat nisi elementum nisi vulputate, pharetra rutrum nulla facilisis. Integer id aliquam ex."
"Aliquam vitae lorem tempor, dapibus lorem non, gravida metus. Duis auctor auctor ex, sed dapibus dolor condimentum id. Nullam fermentum quam eget augue vehicula aliquet id in lectus. Nullam nec eros vel justo semper varius. Integer quis maximus justo. Nulla pellentesque sodales nisl, ac efficitur augue ornare nec. Pellentesque ut laoreet mauris."
"Sed eu tortor maximus, vestibulum quam accumsan, scelerisque nibh. Ut pulvinar ligula consectetur, porttitor justo sed, sodales nunc. Vestibulum cursus metus ac turpis tincidunt auctor eu nec dui. Sed ac convallis nisi. Etiam molestie commodo consectetur. Phasellus ullamcorper elit ut nisl iaculis rhoncus. Aliquam sapien nulla, interdum dignissim velit vel, laoreet sodales nunc. Nam augue lectus, ornare a justo sed, viverra sollicitudin dui. Etiam rhoncus ipsum eget molestie commodo. Nam eget efficitur metus. Quisque ex ex, condimentum vel finibus egestas, pretium sed turpis. Cras in orci et est laoreet rutrum. Phasellus scelerisque efficitur venenatis. Aenean imperdiet quam vel viverra blandit."
"Sed lectus nulla, pellentesque vitae lacus maximus, pellentesque sagittis urna. Morbi felis risus, tristique ut dictum a, ullamcorper in quam. Proin pellentesque sagittis velit, nec aliquam tellus luctus nec. Proin sodales vitae nisl in pellentesque. Morbi a ante feugiat, lacinia mi id, egestas risus. Fusce volutpat gravida diam. Class aptent taciti sociosqu ad litora torquent per conubia nostra, per inceptos himenaeos. Integer malesuada molestie ligula, eget convallis eros consequat eget. Nulla in rutrum dui. Duis laoreet justo at sodales scelerisque. Vivamus commodo varius viverra. Morbi sagittis justo consequat justo sollicitudin porttitor. Vivamus pretium suscipit lectus nec consectetur. In id est in mauris varius tempor."
"Aliquam mollis sit amet dui ut cursus. Quisque eu risus nec nisl tempus dictum pulvinar id lorem. Ut pulvinar quis arcu sed feugiat. Sed imperdiet lacus sit amet ante varius fermentum nec at ipsum. Duis eu fermentum magna. Vivamus a lorem nisl. Fusce tristique est velit, sit amet congue magna venenatis a."
"Vestibulum scelerisque tellus vel erat bibendum lobortis. Integer feugiat, purus at maximus convallis, urna odio tincidunt leo, at vulputate libero metus a mi. Proin iaculis blandit quam, eu vulputate quam iaculis ut. Nam sed libero in ante dapibus mattis. Maecenas et augue at purus pellentesque iaculis sed at ex. Cras semper ante turpis, imperdiet rhoncus est dignissim sit amet. Maecenas nec arcu justo. Aliquam non risus dolor. Cras eget vehicula erat. Pellentesque habitant morbi tristique senectus et netus et malesuada fames ac turpis egestas. Suspendisse sodales cursus elementum. Cras maximus consequat dolor."
"Aliquam eu augue id massa fringilla gravida sed a est. Quisque lobortis libero quis pulvinar consequat. Nunc vitae consequat urna. Vestibulum faucibus dui est, posuere malesuada augue fringilla ut. In non dui id erat semper vestibulum. Sed elementum metus ac justo tempus dignissim. Vivamus id ipsum mi. Mauris at tincidunt ligula, et pretium massa. Maecenas vitae rutrum erat, ullamcorper lobortis mauris."
"Pellentesque habitant morbi tristique senectus et netus et malesuada fames ac turpis egestas. Donec metus lectus, bibendum a sapien et, facilisis sollicitudin neque. Praesent mattis condimentum cursus. Suspendisse non feugiat arcu. Nunc a felis sed lorem tempor tristique id non leo. Maecenas tempus sapien velit, ut luctus erat dictum et. Nullam sed nunc in felis lacinia ultrices vel eget nisi. In hendrerit lorem vitae consequat dignissim. Vivamus in consequat libero. Quisque sagittis bibendum arcu, nec porta nisl cursus sed."
"Quisque quis mollis ex. Aliquam sed nisl nisl. In porta aliquam convallis. Curabitur semper elit tortor, sit amet sagittis ex finibus ac. Nam nec lorem eu turpis faucibus rhoncus quis eget massa. Sed id nunc euismod felis luctus fringilla mollis quis odio. Aenean sagittis maximus fermentum. Duis scelerisque ligula sit amet ipsum fermentum placerat. Nulla sagittis auctor est, vel volutpat justo porta a. Sed feugiat, nibh aliquet vehicula feugiat, nunc tortor dapibus metus, vulputate accumsan nisl risus at sem. Cras dictum posuere tincidunt. Nam congue ullamcorper risus, ut venenatis turpis faucibus in. Nulla id nulla eget justo vulputate pellentesque in vel nulla. Class aptent taciti sociosqu ad litora torquent per conubia nostra, per inceptos himenaeos. Phasellus mauris velit, dapibus vitae nulla eu, facilisis rutrum urna."
"Curabitur hendrerit lectus ligula, quis finibus turpis placerat in. Nullam volutpat, massa non commodo blandit, diam enim commodo neque, quis vulputate ex nibh non augue. Nunc rhoncus velit varius, mattis purus eget, gravida enim. Nam laoreet tellus nulla, et varius sem sollicitudin et. Curabitur egestas tortor maximus, iaculis felis in, dapibus purus. Lorem ipsum dolor sit amet, consectetur adipiscing elit. Suspendisse pretium neque id velit semper, vel congue tellus fermentum. Sed eu augue finibus, feugiat erat nec, lacinia ex. Pellentesque a facilisis risus, a tincidunt justo. Sed pretium leo non elementum aliquam."
"Fusce at tincidunt massa, pretium vestibulum ipsum. Fusce sagittis pharetra lectus non sollicitudin. Mauris feugiat nulla nisi, sed posuere magna dapibus eget. Pellentesque nibh massa, lacinia quis sollicitudin eget, ullamcorper et neque. Nunc nisi quam, euismod eu dui nec, auctor sollicitudin erat. Mauris sagittis et lorem ut pharetra. Phasellus mollis pellentesque nulla, vel bibendum dui sodales id. Curabitur lacus tellus, condimentum eget aliquet ac, tincidunt eget arcu. Mauris felis ipsum, commodo nec massa eu, mattis tempor metus. Aliquam interdum quis tortor sed posuere. Nulla egestas metus nibh, sit amet dapibus odio vehicula sed. Mauris eu elit vel libero fringilla rutrum a placerat mauris."
"In non eros convallis, aliquet lacus eu, commodo magna. Fusce sodales laoreet diam nec tempus. Integer at pellentesque lacus. Sed elementum, leo et sagittis hendrerit, orci odio cursus sapien, ac tincidunt est libero non magna. Cras consectetur diam tortor, vel venenatis eros iaculis quis. Donec cursus eros eu commodo efficitur. Suspendisse ac justo a libero dapibus suscipit ut eu mauris. Vestibulum molestie aliquam massa, at tincidunt nunc placerat nec. Cras lacinia arcu ut tellus facilisis venenatis. Nunc maximus auctor eros a feugiat."
"Suspendisse semper, arcu ac faucibus mattis, purus magna venenatis felis, a porta dui metus eget nibh. In varius leo eget neque tristique tempor. Suspendisse ullamcorper vitae felis ac elementum. Ut sed metus eu odio convallis varius non quis leo. Duis quis diam vitae mi venenatis dignissim. Mauris egestas leo eu fermentum maximus. Nulla dolor neque, gravida sed velit non, dictum cursus tellus. Interdum et malesuada fames ac ante ipsum primis in faucibus."
"Aenean sed euismod felis. Nulla hendrerit molestie tellus, id pellentesque ex sagittis ut. Suspendisse potenti. Duis nisl neque, lacinia vitae ultricies eu, scelerisque in ipsum. Donec consectetur nisl sit amet sapien tempor, eu dignissim turpis elementum. Fusce varius ex porttitor mattis molestie. In egestas blandit lacinia. Sed lobortis nec metus vulputate interdum. Nunc pharetra, elit non bibendum pharetra, ligula arcu commodo odio, egestas convallis ex libero sed lorem. Donec ultrices tincidunt semper. Orci varius natoque penatibus et magnis dis parturient montes, nascetur ridiculus mus. In eget magna dignissim nibh venenatis sodales id quis elit. Suspendisse potenti. Phasellus ac dolor in velit volutpat auctor eget id enim."
"Maecenas ac laoreet est. Duis rutrum sem a risus imperdiet, vel malesuada diam varius. Morbi dapibus efficitur nisi, ut finibus purus rhoncus at. Cras tristique varius erat et accumsan. Fusce sit amet luctus ipsum, feugiat cursus tellus. Nulla scelerisque mattis libero, vitae dignissim lectus feugiat non. In euismod risus at nulla laoreet, at elementum eros tempor. Nullam aliquam turpis dolor, non lobortis arcu luctus viverra. Etiam pretium vehicula odio id vestibulum. Donec sagittis, diam eget efficitur sodales, libero massa tristique odio, vel pharetra sapien massa in massa. Fusce scelerisque tortor vitae aliquet ultrices. Nunc mattis ante lacus. Sed eleifend ultrices rutrum. Nulla facilisi. Proin mollis nibh ac ex sagittis scelerisque."
"Cras a rutrum est. Curabitur nec mi aliquam, ultricies purus tristique, elementum quam. Sed et diam augue. In sit amet congue ipsum. Duis et mi nec sem pharetra porta nec at mi. Quisque non lorem orci. Nam consequat non nisi a tincidunt. In hac habitasse platea dictumst. Nullam eu metus at leo auctor sollicitudin. Class aptent taciti sociosqu ad litora torquent per conubia nostra, per inceptos himenaeos. Nullam tincidunt, eros sed tincidunt gravida, nulla tellus cursus mi, vel sollicitudin massa nunc vel libero. Proin feugiat, odio et tristique pharetra, eros lectus tempor nunc, nec vulputate turpis diam nec massa. Praesent maximus quam vel tellus vestibulum venenatis. Cras nulla enim, dapibus quis metus vitae, consectetur fermentum urna. Sed ut sem eu ipsum consectetur vehicula."
"Morbi semper finibus dui, ut sagittis velit egestas quis. Etiam nec justo vitae velit euismod interdum. In tempus mi in condimentum dignissim. Quisque dignissim elit ac vulputate consectetur. Donec elit est, condimentum in justo eu, euismod imperdiet justo. Ut id nibh non quam efficitur fringilla ut at felis. Aenean varius scelerisque dolor, eget maximus enim condimentum ac. Vivamus in nunc ex. Sed nec condimentum elit. Maecenas eu purus a augue porttitor facilisis."
"Praesent non rutrum odio. Sed lacinia ipsum lorem, sit amet tristique diam tristique a. Etiam aliquam nec magna sit amet tincidunt. Cras ut leo finibus, dapibus lorem a, volutpat ligula. Vestibulum ante ipsum primis in faucibus orci luctus et ultrices posuere cubilia Curae; Duis a auctor odio. Quisque consequat eu lectus eget ultricies. Nullam et magna ultrices, pulvinar magna nec, sodales elit. Nulla nunc nisi, feugiat vel lorem sit amet, venenatis efficitur tortor. Nam eu lacinia neque, viverra interdum tellus. Curabitur est tortor, sollicitudin ac lorem nec, mattis pharetra justo. Phasellus sed lacus convallis, molestie purus sit amet, vulputate velit. Donec et luctus mauris. Integer sollicitudin massa nunc, non luctus libero sodales sit amet. Morbi finibus rutrum pulvinar."
"Praesent sed justo felis. Morbi rutrum, justo eu finibus placerat, velit dui consequat ligula, in congue metus sapien non tortor. Quisque libero turpis, ornare quis quam eget, consequat maximus urna. Ut nulla lorem, ornare nec orci sed, ullamcorper aliquet felis. Sed nisl velit, pulvinar nec nisi sit amet, vestibulum pulvinar augue. Nunc quis quam blandit, gravida nibh ut, convallis orci. Maecenas finibus congue felis at ornare. In hac habitasse platea dictumst. Sed sollicitudin dolor mattis, tincidunt diam eget, fringilla ipsum. Quisque tellus justo, varius nec finibus ac, blandit et mauris. Donec quis odio hendrerit, mattis mauris id, auctor eros. Donec et lobortis metus, id venenatis nulla. Donec dictum vel elit pharetra sodales. Cras vel pellentesque ante. Class aptent taciti sociosqu ad litora torquent per conubia nostra, per inceptos himenaeos."
"Sed est orci, mattis at condimentum ut, blandit sit amet lectus. Ut sit amet nibh scelerisque massa tristique malesuada. Etiam dictum libero eu ullamcorper finibus. Curabitur at condimentum massa, sit amet elementum massa. Phasellus fermentum felis sed convallis tincidunt. Donec elementum condimentum leo. Maecenas viverra quam eu luctus varius. Mauris pellentesque laoreet sodales. Pellentesque sagittis vehicula pretium. Nulla sed nunc non enim accumsan convallis eget sed turpis."
"Fusce pellentesque scelerisque orci, non gravida tortor mollis sed. Sed at gravida urna. Morbi pellentesque, sem pulvinar fringilla molestie, erat enim vestibulum sem, sed dictum tellus mi in purus. Curabitur pellentesque urna non tellus rutrum, ac accumsan orci luctus. Vivamus sit amet nulla id diam sodales imperdiet. Integer tristique elit dui, eu viverra diam cursus eu. Quisque finibus eros diam, a convallis nibh dictum volutpat. Nam arcu dolor, sodales nec justo non, commodo dapibus tellus. Praesent pulvinar, nibh ac vestibulum semper, neque ligula porta dolor, vel finibus urna dui eget arcu."
"Vestibulum posuere lacinia mattis. Vivamus non dui dapibus, faucibus ex nec, maximus velit. In eget rhoncus dolor, nec vestibulum ipsum. Donec eleifend, justo in posuere condimentum, tortor tellus accumsan nisl, pellentesque maximus elit odio eu sapien. Duis blandit, purus at mattis pretium, massa turpis porta tellus, vel luctus lectus erat at urna. Morbi sed finibus enim. Nam malesuada augue ut molestie hendrerit. Nunc vel nisi quis dolor volutpat pharetra. Duis pharetra pretium sapien id blandit. Nullam pharetra nulla a suscipit fermentum. Fusce eget lectus risus."
"Pellentesque malesuada nunc suscipit porta ultricies. Praesent placerat justo nec sapien varius, id fermentum nulla viverra. Maecenas rhoncus id nisi nec vulputate. In dignissim convallis mi vitae iaculis. Nullam urna nibh, posuere eu hendrerit quis, fermentum vel nisl. Lorem ipsum dolor sit amet, consectetur adipiscing elit. Phasellus sagittis bibendum odio ac pharetra. Proin pretium dolor quis orci placerat, ut tincidunt quam varius. Nulla molestie pulvinar ultricies. Curabitur convallis, nisl non varius volutpat, libero lorem blandit eros, eu eleifend risus urna sed mauris. Aenean at euismod purus. Nullam consectetur tortor sed quam laoreet pharetra. Pellentesque habitant morbi tristique senectus et netus et malesuada fames ac turpis egestas. Nunc ullamcorper tortor at nisl egestas, in dictum mi feugiat. Nunc sit amet lectus sed lacus pharetra malesuada at sed augue. Nulla sodales venenatis erat ac ornare."
"Mauris sed lectus condimentum, feugiat risus sit amet, consequat elit. Sed sollicitudin, justo non tincidunt tristique, nisl libero convallis metus, ac feugiat augue odio id arcu. Etiam efficitur venenatis massa ac tristique. Mauris aliquam augue sodales lectus sodales pharetra. Nunc porta, urna et vulputate auctor, mauris metus sodales nunc, euismod pretium purus ipsum ut magna. Duis dictum arcu nec lectus accumsan, non imperdiet nisi malesuada. Aenean nec neque lorem. Quisque volutpat rutrum neque vel maximus. Suspendisse mattis cursus risus, vitae sollicitudin justo viverra a. Pellentesque finibus commodo arcu vel fringilla. Vestibulum ante ipsum primis in faucibus orci luctus et ultrices posuere cubilia Curae; Sed vitae massa orci."
"Nulla hendrerit orci sit amet est pharetra euismod. Morbi blandit tortor turpis, in suscipit justo pretium quis. Donec ullamcorper quam sed metus volutpat dapibus. Ut ut leo in metus lobortis varius. Ut finibus est a lectus accumsan varius. Vivamus eleifend nisl nec augue accumsan, nec consectetur erat egestas. Donec sit amet ipsum ex. Nam condimentum ante sollicitudin, venenatis lectus id, malesuada lorem. Cras ac vulputate ligula. Vestibulum quis malesuada nulla, ut tempor tellus. Vestibulum vitae tincidunt orci."
"Fusce interdum elementum risus. Ut fermentum hendrerit massa, volutpat feugiat metus tincidunt non. Praesent eget gravida elit. Pellentesque sit amet eros sit amet quam pharetra accumsan malesuada ac justo. Quisque scelerisque sodales risus vel blandit. Sed vitae felis tortor. Etiam consequat ipsum eget sapien eleifend, eget faucibus nunc placerat. Lorem ipsum dolor sit amet, consectetur adipiscing elit. Morbi ultricies vulputate interdum. In placerat diam nunc, et dictum justo tincidunt quis. Aenean vestibulum cursus risus vitae tincidunt. Suspendisse nec pharetra turpis. Maecenas eleifend augue nunc, ut laoreet ipsum volutpat id. Morbi ultrices erat felis, in pretium massa sodales ut. Nam elementum id ex a convallis."
"Duis at porttitor leo, eu sodales nunc. Cras sollicitudin nulla et erat vehicula egestas. In hendrerit ligula felis, sit amet viverra mauris accumsan eu. Vestibulum arcu risus, maximus a imperdiet vitae, rhoncus non turpis. Nam iaculis ornare lectus eu dignissim. Nunc et sapien a sem mollis efficitur. Donec in neque aliquet orci laoreet pulvinar. Integer tortor odio, laoreet vel varius eu, aliquet sed libero. Vestibulum consectetur, urna at vehicula gravida, augue tellus malesuada enim, vel blandit lectus felis sed leo."
"In ac augue massa. Cras sit amet neque fringilla, commodo lectus quis, aliquet orci. Pellentesque malesuada dui sit amet blandit venenatis. In hac habitasse platea dictumst. Ut eget ex sit amet massa aliquet bibendum ac vel felis. Curabitur pretium urna justo, id hendrerit elit sodales sed. Vivamus laoreet porttitor risus non rutrum. Aenean gravida luctus sem nec volutpat. Duis luctus quis ligula a cursus. Sed tristique mi at est lobortis, non vehicula purus scelerisque."
"Praesent bibendum massa nibh, eget convallis lectus tincidunt in. Mauris cursus augue a est rutrum, nec consequat tortor fringilla. Nam iaculis ex eu enim tristique posuere. Fusce eget arcu felis. Nunc rutrum, ipsum vitae tristique sollicitudin, arcu ante sagittis enim, eu laoreet quam tellus nec neque. Nulla facilisis leo vel diam cursus, a eleifend mi malesuada. Pellentesque luctus ornare sodales. Phasellus ultricies, nisl sed maximus condimentum, metus lorem luctus urna, nec ultrices ante diam vitae lacus. Duis feugiat nulla sit amet porttitor suscipit. Nullam sed tincidunt ante, maximus maximus metus."
"Sed non dictum mauris. Vestibulum a sem quis diam cursus pulvinar. Etiam mollis mauris id purus iaculis, sit amet consectetur odio auctor. Maecenas viverra dapibus arcu ac viverra. Nam fermentum turpis in luctus suscipit. Quisque nisl nisi, elementum eget tincidunt nec, feugiat sit amet ante. Nunc mattis elementum elementum. Morbi dapibus enim ut nibh sodales, a tincidunt lectus pretium. Etiam vel sem ut erat tristique fermentum quis tempor mi. Vivamus sollicitudin feugiat quam, id sollicitudin risus euismod tincidunt. Praesent mauris est, suscipit maximus turpis vestibulum, maximus malesuada erat. Mauris fermentum massa in odio sodales, non tristique neque sollicitudin. Suspendisse potenti. Aenean id tincidunt magna. Vestibulum ante ipsum primis in faucibus orci luctus et ultrices posuere cubilia Curae;"
"Sed accumsan ipsum in nisi efficitur lobortis. Nullam ut efficitur sapien, at finibus eros. Maecenas nulla ex, tempus vel lobortis a, interdum in justo. Pellentesque purus lectus, aliquam dignissim nisl id, volutpat convallis arcu. In porta eu sapien ut porttitor. Etiam sit amet molestie justo, vel hendrerit felis. Sed velit enim, mattis ut sollicitudin dictum, blandit condimentum tellus."
"Pellentesque elementum nisl tempor, facilisis enim sed, lobortis risus. Donec ut sem velit. Quisque posuere quam vitae vehicula ultrices. Lorem ipsum dolor sit amet, consectetur adipiscing elit. Donec in dictum nunc. Nullam non ultricies lacus. Duis sed malesuada justo, vitae sodales metus. Maecenas congue, velit ac vestibulum tristique, lorem velit varius augue, vitae mattis neque felis quis dolor. Ut faucibus feugiat ligula. Sed id auctor arcu, vel volutpat metus. Pellentesque lacinia neque at metus aliquet, id bibendum metus fringilla."
"In ac ex non dolor eleifend tempor. Praesent erat erat, mollis ut egestas id, commodo at urna. Duis sed felis velit. Morbi maximus odio elementum dolor finibus, sit amet efficitur ligula congue. Maecenas mattis, sapien id imperdiet sollicitudin, felis odio accumsan est, id aliquet metus odio ac massa. Nam ultricies orci eu lectus tincidunt, sed fringilla nulla facilisis. Vivamus id mauris facilisis, dapibus mi a, rhoncus dolor. Integer neque mi, tincidunt a massa eu, volutpat mattis nibh. In sed vehicula augue. Morbi vestibulum in libero ac pretium. Pellentesque pharetra fermentum nibh, consectetur vulputate ante euismod et. Ut euismod, ante eget porta imperdiet, dui odio sollicitudin orci, ut dignissim leo velit eu nunc. Vestibulum faucibus sollicitudin magna sed placerat."
"Integer eleifend neque erat, id bibendum leo pellentesque eu. Etiam dignissim metus et vulputate sagittis. Mauris in malesuada nisi. Duis eleifend lorem in pulvinar bibendum. Nullam varius rhoncus malesuada. Donec et sollicitudin nisl. Nulla ante sapien, interdum et rhoncus et, tempor non tortor."
"Praesent id efficitur nisl, blandit ultricies nisl. Quisque scelerisque egestas varius. Etiam eu gravida libero, sed luctus lectus. Nulla convallis semper volutpat. Proin ac justo id lorem tempor dapibus. Maecenas condimentum molestie odio sed luctus. Vestibulum ante ipsum primis in faucibus orci luctus et ultrices posuere cubilia Curae; Donec egestas mauris sed libero rhoncus congue. Sed gravida convallis ligula, sit amet dignissim urna posuere nec. Nulla gravida est et vehicula tempor. Morbi laoreet quis lorem rhoncus hendrerit."
"Morbi vitae nisl vel nunc egestas ornare. Morbi ultricies sit amet est fermentum vehicula. Maecenas luctus ornare massa, ut pharetra augue iaculis ac. Cras egestas mi at pretium finibus. Donec nec egestas nibh, vel semper sem. Nam at nisl euismod magna luctus egestas quis vitae turpis. Donec venenatis elit felis, nec molestie massa laoreet quis. Etiam consequat sodales elementum. Fusce eget tortor eleifend dolor condimentum porttitor. Donec et tortor sit amet lectus accumsan pharetra vel vitae felis. Integer gravida tempus eros sit amet aliquet. Quisque id nulla neque. Quisque gravida ornare diam, et pellentesque lacus. Nam tristique, odio vitae mattis tincidunt, nulla arcu ullamcorper lectus, vitae lobortis nibh sem vitae ex."
"Aenean nec vulputate lectus. Donec semper commodo tempus. Nunc dignissim neque libero, vitae rutrum tortor vulputate quis. Phasellus nisi ipsum, rhoncus id neque eu, euismod fermentum augue. Proin faucibus molestie justo, ut tempus eros condimentum ut. Suspendisse sit amet mollis erat, vel placerat tortor. Fusce sit amet feugiat sem. Pellentesque habitant morbi tristique senectus et netus et malesuada fames ac turpis egestas. Morbi finibus dui at vulputate lacinia. Phasellus luctus libero sodales convallis vehicula. Maecenas viverra velit id mollis efficitur. Donec semper in purus at eleifend. Donec ac ante dapibus, convallis metus sed, imperdiet massa. Integer metus diam, maximus a neque accumsan, commodo viverra nisi."
"Suspendisse fermentum, felis quis iaculis cursus, urna purus efficitur erat, ac rutrum mi turpis quis sem. Integer vel sapien bibendum, euismod enim in, scelerisque justo. Aliquam at turpis egestas, varius quam eu, faucibus neque. Phasellus pharetra eros luctus enim finibus, quis sodales augue eleifend. Etiam ac ex tortor. Nulla eget elit odio. Praesent ac dictum felis. Pellentesque id lorem accumsan, hendrerit arcu quis, ornare est. Nullam molestie lobortis iaculis. Nam posuere turpis vitae dui tempus tempus. Nunc hendrerit non enim eget efficitur."
"Ut imperdiet eros feugiat, rhoncus nisi eget, hendrerit tellus. Nunc vel nunc vestibulum mi feugiat posuere. Aenean ultricies quam mauris, eu placerat velit laoreet ac. Morbi tempus id lectus vitae pellentesque. Proin auctor orci volutpat risus pulvinar suscipit. Ut pellentesque est laoreet malesuada accumsan. Nam viverra magna non sapien imperdiet, vel hendrerit est efficitur."
"Fusce consequat placerat luctus. Cras justo nisi, molestie quis erat vitae, tincidunt vehicula lorem. Fusce at viverra justo. Duis in commodo mi, luctus imperdiet ipsum. In eget vestibulum eros. Cras molestie ut nunc vitae aliquet. Ut in cursus magna. Integer malesuada finibus neque, quis luctus tellus maximus eu. Morbi sagittis arcu imperdiet tempor bibendum. Vestibulum ac dapibus nisl."
"Nulla viverra, justo eu vulputate tristique, sem dolor ullamcorper libero, et hendrerit risus sem non turpis. Praesent vitae pharetra dolor, vel viverra velit. Ut sed efficitur sapien, non iaculis urna. Nullam cursus, leo ac bibendum lacinia, neque risus condimentum mi, vel maximus dui urna at dui. Morbi ut dapibus tortor. Suspendisse mollis posuere neque, at venenatis arcu efficitur non. Fusce quis justo euismod, faucibus dui eu, tincidunt nulla. Ut nisi sapien, varius vel euismod eget, aliquam et turpis. Duis sed dapibus massa. Curabitur at convallis nibh. In urna felis, tempor ut ornare laoreet, vehicula vel nibh. Curabitur nunc risus, blandit ac aliquet sed, dictum vitae est. Integer mollis eros eu nibh placerat, vel pellentesque nulla ultrices. Vivamus sed sapien varius, varius erat nec, tempus lacus."
"Vestibulum ante ipsum primis in faucibus orci luctus et ultrices posuere cubilia Curae; Etiam maximus metus tempor felis posuere, at pharetra ex ultrices. Vivamus condimentum sagittis lectus, efficitur luctus neque pulvinar a. Sed ut fermentum justo. Orci varius natoque penatibus et magnis dis parturient montes, nascetur ridiculus mus. Phasellus sit amet gravida nunc. Quisque congue enim vitae nunc ullamcorper, vitae dapibus felis elementum. Morbi vehicula massa nec pellentesque efficitur. Quisque ultricies ut libero quis tincidunt. Morbi congue turpis eget enim pulvinar finibus. Donec ac ornare odio. Sed et dictum risus. Sed a blandit nisl. Proin mollis ligula non varius aliquam. Proin eu turpis gravida, suscipit turpis sed, blandit mauris. Vestibulum malesuada rhoncus sollicitudin."
